{
  "$schema": "http://json-schema.org/draft-07/schema#",
  "title": "Media Plan PY Workspace Configuration",
  "type": "object",
  "required": ["workspace_id", "workspace_name", "storage"],
  "properties": {
    "workspace_id": {
      "type": "string",
      "description": "Unique identifier for this workspace"
    },
    "workspace_name": {
      "type": "string",
      "description": "Name of this workspace configuration"
    },
    "workspace_status": {
      "type": "string",
      "enum": ["active", "inactive"],
      "default": "active",
      "description": "Status of this workspace - inactive workspaces have restricted operations"
    },
    "environment": {
      "type": "string",
      "description": "Environment this configuration applies to",
      "enum": ["development", "testing", "production"],
      "default": "development"
    },
    "storage": {
      "type": "object",
      "required": ["mode"],
      "properties": {
        "mode": {
          "type": "string",
          "enum": ["local", "s3", "gdrive"],
          "default": "local",
          "description": "Storage mode for media plans"
        },
        "local": {
          "type": "object",
          "properties": {
            "base_path": {
              "type": "string",
              "description": "Base directory for storing media plans"
            },
            "create_if_missing": {
              "type": "boolean",
              "default": true,
              "description": "Create directory if it doesn't exist"
            }
          }
        },
        "s3": {
          "type": "object",
          "required": ["bucket", "region"],
          "properties": {
            "bucket": {
              "type": "string",
              "description": "S3 bucket name"
            },
            "region": {
              "type": "string",
              "description": "AWS region (e.g., us-east-1, eu-west-1)"
            },
            "prefix": {
              "type": "string",
              "description": "Optional prefix for all objects. Defaults to workspace_id if not specified."
            },
            "profile": {
              "type": "string",
              "description": "AWS profile name to use for authentication"
            },
            "endpoint_url": {
              "type": "string",
              "description": "Custom S3 endpoint URL (for S3-compatible services)"
            },
            "use_ssl": {
              "type": "boolean",
              "default": true,
              "description": "Use SSL/TLS for S3 connections"
            }
          }
        },
        "gdrive": {
          "type": "object",
          "properties": {
            "folder_id": {
              "type": "string",
              "description": "Google Drive folder ID to store media plans"
            },
            "credentials_path": {
              "type": "string",
              "description": "Path to Google API credentials file"
            },
            "token_path": {
              "type": "string",
              "description": "Path to store the OAuth token"
            }
          }
        }
      }
    },
    "workspace_settings": {
      "type": "object",
      "description": "Workspace version and compatibility settings",
      "properties": {
        "schema_version": {
          "type": "string",
          "description": "Current workspace schema version in 2-digit format (e.g., '1.0')",
          "pattern": "^[0-9]+\\.[0-9]+$"
        },
        "last_upgraded": {
          "type": "string",
          "format": "date",
          "description": "Date when workspace was last upgraded (YYYY-MM-DD)"
        },
        "sdk_version_required": {
          "type": "string",
          "description": "Minimum SDK version required for this workspace (e.g., '1.0.x')",
          "pattern": "^[0-9]+\\.[0-9]+\\.[0-9x]+$"
        }
      }
    },
    "schema_settings": {
      "type": "object",
      "description": "Schema configuration settings (deprecated fields removed)"
    },
    "database": {
      "type": "object",
      "description": "PostgreSQL database configuration for automatic media plan sync",
      "properties": {
        "enabled": {
          "type": "boolean",
          "default": false,
          "description": "Enable automatic database synchronization when saving media plans"
        },
        "host": {
          "type": "string",
          "description": "PostgreSQL host address"
        },
        "port": {
          "type": "integer",
          "default": 5432,
          "description": "PostgreSQL port number"
        },
        "database": {
          "type": "string",
          "description": "Database name"
        },
        "schema": {
          "type": "string",
          "default": "public",
          "description": "Database schema name"
        },
        "table_name": {
          "type": "string",
          "default": "media_plans",
          "description": "Table name for storing media plan data"
        },
        "username": {
          "type": "string",
          "description": "Database username for authentication"
        },
        "password_env_var": {
          "type": "string",
          "description": "Environment variable name containing the database password"
        },
        "ssl": {
          "type": "boolean",
          "default": true,
          "description": "Use SSL for database connections"
        },
        "connection_timeout": {
          "type": "integer",
          "default": 30,
          "description": "Connection timeout in seconds"
        },
        "auto_create_table": {
          "type": "boolean",
          "default": true,
          "description": "Automatically create the media plans table if it doesn't exist"
        }
      }
    },
    "excel": {
      "type": "object",
      "description": "Excel configuration",
      "properties": {
        "enabled": {
          "type": "boolean",
          "default": true,
          "description": "Enable Excel import/export functionality"
        },
        "template_path": {
          "type": "string",
          "description": "Path to Excel template file"
        }
      }
    },
    "google_sheets": {
      "type": "object",
      "description": "Google Sheets configuration",
      "properties": {
        "enabled": {
          "type": "boolean",
          "default": false,
          "description": "Enable Google Sheets integration"
        },
        "credentials_path": {
          "type": "string",
          "description": "Path to Google API credentials file"
        },
        "template_id": {
          "type": "string",
          "description": "ID of template Google Sheet to use for exports"
        }
      }
    },
    "logging": {
      "type": "object",
      "description": "Logging configuration",
      "properties": {
        "level": {
          "type": "string",
          "enum": ["DEBUG", "INFO", "WARNING", "ERROR", "CRITICAL"],
          "default": "INFO"
        },
        "file": {
          "type": "string",
          "description": "Optional log file path"
        }
      }
    }
  }
}